Request ID,Service,Customer Name,Professional Name,Date Requested,Date Completed,Status,Remarks,Rating,Review Comment
1,Plumbing Service,Christy Smith,Kendra Mccoy,2024-09-24 15:49,2024-09-24 15:00,completed,Service completed successfully.,3,Work done but communication was poor. Prepare collection for far of record event.
2,Plumbing Service,Christy Smith,Terri Owens,2024-09-14 15:49,2024-09-14 15:00,completed,Service completed successfully.,2,"Below expectations, multiple issues. Organization begin remain effort."
3,Home Cleaning,Christy Smith,Mrs. Mia Williams,2024-09-20 15:49,2024-09-20 16:00,completed,Service completed successfully.,4,Professional and efficient work. Alone lose event traditional ten talk here.
4,Home Cleaning,Christy Smith,Kendra Mccoy,2024-09-08 15:49,2024-09-08 14:00,completed,Service completed successfully.,3,"Average service, room for improvement. Remember too bit."
5,Plumbing Service,Todd Ramirez,Kendra Mccoy,2024-11-01 15:49,2024-11-01 16:00,completed,Service completed successfully.,5,Excellent service! Very professional and punctual. Republican type second issue.
6,Home Cleaning,Todd Ramirez,Kendra Mccoy,2024-09-04 15:49,2024-09-04 15:00,completed,Service completed successfully.,3,"Average service, room for improvement. Large provide wife present candidate rest why."
7,Electrical Work,Todd Ramirez,Suzanne Ware,2024-11-04 15:49,2024-11-04 13:00,completed,Service completed successfully.,4,"Good service, met expectations. Decision share act hair including."
8,Plumbing Service,Todd Ramirez,Terri Owens,2024-09-03 15:49,2024-09-03 17:00,completed,Service completed successfully.,5,"Outstanding service, highly recommended! Ahead hope still sister method gas."
9,Home Cleaning,Joseph Hill,Kendra Mccoy,2024-10-26 15:49,2024-10-26 15:00,completed,Service completed successfully.,3,Work done but communication was poor. Role beat upon.
10,Electrical Work,Joseph Hill,Suzanne Ware,2024-09-02 15:49,2024-09-02 14:00,completed,Service completed successfully.,N/A,N/A
11,Electrical Work,Joseph Hill,Mrs. Mia Williams,2024-10-01 15:49,2024-10-01 15:00,completed,Service completed successfully.,2,"Below expectations, multiple issues. Whose true include total."
12,Plumbing Service,Christy Wilson,Kendra Mccoy,2024-09-29 15:49,2024-09-29 14:00,completed,Service completed successfully.,4,Quality service but a bit expensive. Piece but positive need sign.
13,Plumbing Service,Christy Wilson,Kendra Mccoy,2024-11-06 15:49,2024-11-06 17:00,completed,Service completed successfully.,4,Quality service but a bit expensive. Weight simple impact final.
14,Electrical Work,Christy Wilson,Kendra Mccoy,2024-11-08 15:49,2024-11-08 15:00,completed,Service completed successfully.,4,Professional and efficient work. Official green happy agreement here.
15,House Painting,Brian Day,Kendra Mccoy,2024-09-28 15:49,2024-09-28 17:00,completed,Service completed successfully.,3,Work done but communication was poor. Herself north product scene ok indicate.
16,Home Cleaning,Brian Day,Suzanne Ware,2024-10-09 15:49,2024-10-09 15:00,completed,Service completed successfully.,3,Work done but communication was poor. Blue time writer a hit.
17,Electrical Work,Brian Day,Suzanne Ware,2024-10-09 15:49,2024-10-09 16:00,completed,Service completed successfully.,5,"Outstanding service, highly recommended! Worry red apply remain."
18,Electrical Work,Brian Day,Suzanne Ware,2024-10-29 15:49,2024-10-29 17:00,completed,Service completed successfully.,3,"Average service, room for improvement. Seat main argue improve."
19,Home Cleaning,Jill Kim,Kendra Mccoy,2024-11-06 15:49,2024-11-06 15:00,completed,Service completed successfully.,N/A,N/A
20,Home Cleaning,Jill Kim,Mrs. Mia Williams,2024-10-05 15:49,2024-10-05 17:00,completed,Service completed successfully.,3,"Average service, room for improvement. When happen those also under pressure rule."
21,House Painting,Jill Kim,Terri Owens,2024-10-15 15:49,2024-10-15 17:00,completed,Service completed successfully.,3,Work done but communication was poor. Enjoy yes glass enough receive environmental rather next.
22,Home Cleaning,Steven Barrett,Kendra Mccoy,2024-10-21 15:49,2024-10-21 17:00,completed,Service completed successfully.,3,Work done but communication was poor. One friend student election each.
23,House Painting,Steven Barrett,Kendra Mccoy,2024-10-09 15:49,2024-10-09 17:00,completed,Service completed successfully.,4,Professional and efficient work. Decade message either home.
24,Electrical Work,Patrick Stevens,Suzanne Ware,2024-10-25 15:49,2024-10-25 12:00,completed,Service completed successfully.,3,Work done but communication was poor. Seek yet degree.
25,House Painting,Patrick Stevens,Suzanne Ware,2024-11-03 15:49,2024-11-03 17:00,completed,Service completed successfully.,4,"Good service, met expectations. Shoulder management its area."
26,Home Cleaning,Patrick Stevens,Suzanne Ware,2024-10-09 15:49,2024-10-09 15:00,completed,Service completed successfully.,4,"Good service, met expectations. Education region pressure far public."
27,Electrical Work,Justin Weeks,Mrs. Mia Williams,2024-09-11 15:49,2024-09-11 13:00,completed,Service completed successfully.,N/A,N/A
28,House Painting,Justin Weeks,Kendra Mccoy,2024-09-01 15:49,2024-09-01 17:00,completed,Service completed successfully.,3,"Average service, room for improvement. Yes effort total daughter at few would."
29,Plumbing Service,Justin Weeks,Suzanne Ware,2024-11-13 15:49,2024-11-13 15:00,completed,Service completed successfully.,3,Work done but communication was poor. Provide plan possible.
30,Home Cleaning,Justin Weeks,Mrs. Mia Williams,2024-11-16 15:49,2024-11-16 14:00,completed,Service completed successfully.,5,"Outstanding service, highly recommended! Admit law month ball consumer leader."
31,Plumbing Service,Justin Weeks,Suzanne Ware,2024-10-02 15:49,2024-10-02 17:00,completed,Service completed successfully.,5,"Outstanding service, highly recommended! Also room challenge much fine."
32,Home Cleaning,Gregory Ray,Terri Owens,2024-09-26 15:49,2024-09-26 15:00,completed,Service completed successfully.,3,Work done but communication was poor. Option indicate two computer tough mean.
33,House Painting,Gregory Ray,Terri Owens,2024-09-05 15:49,2024-09-05 17:00,completed,Service completed successfully.,N/A,N/A
34,House Painting,Gregory Ray,Suzanne Ware,2024-10-26 15:49,2024-10-26 17:00,completed,Service completed successfully.,4,Quality service but a bit expensive. Consider here employee concern Republican impact court.
35,Home Cleaning,Gregory Ray,Kendra Mccoy,2024-11-13 15:49,2024-11-13 14:00,completed,Service completed successfully.,2,"Below expectations, multiple issues. Ten environmental stuff evening many."
36,Home Cleaning,Bryce Davidson,Terri Owens,2024-11-23 15:49,2024-11-23 13:00,completed,Service completed successfully.,N/A,N/A
37,House Painting,Bryce Davidson,Terri Owens,2024-11-17 15:49,2024-11-17 17:00,completed,Service completed successfully.,5,"Outstanding service, highly recommended! Need college scene bill member mouth and fear."
38,Plumbing Service,Bryce Davidson,Suzanne Ware,2024-09-24 15:49,2024-09-24 15:00,completed,Service completed successfully.,5,"Outstanding service, highly recommended! Event but another above until measure sense."
39,Electrical Work,Bryce Davidson,Mrs. Mia Williams,2024-10-30 15:49,2024-10-30 17:00,completed,Service completed successfully.,5,Excellent service! Very professional and punctual. Cover various lawyer officer stay.
40,Electrical Work,Katherine Cooper,Mrs. Mia Williams,2024-09-08 15:49,2024-09-08 17:00,completed,Service completed successfully.,3,Work done but communication was poor. Develop door apply.
41,House Painting,Katherine Cooper,Terri Owens,2024-09-20 15:49,2024-09-20 17:00,completed,Service completed successfully.,N/A,N/A
42,Plumbing Service,Christian Bailey,Mrs. Mia Williams,2024-10-20 15:49,2024-10-20 17:00,completed,Service completed successfully.,2,"Below expectations, multiple issues. Heart activity throughout father anyone."
43,House Painting,Christian Bailey,Mrs. Mia Williams,2024-10-01 15:49,2024-10-01 17:00,completed,Service completed successfully.,5,Excellent service! Very professional and punctual. Coach dog general thing year participant tax.
44,Electrical Work,Christian Bailey,Kendra Mccoy,2024-10-13 15:49,2024-10-13 11:00,completed,Service completed successfully.,5,Excellent service! Very professional and punctual. Glass a product lead.
45,Home Cleaning,Christian Bailey,Kendra Mccoy,2024-11-03 15:49,2024-11-03 17:00,completed,Service completed successfully.,4,Professional and efficient work. Red air nation expert ahead himself.
46,House Painting,Christian Bailey,Kendra Mccoy,2024-11-18 15:49,2024-11-18 17:00,completed,Service completed successfully.,5,Great work quality and attention to detail. Party especially pull carry chance TV.
47,Plumbing Service,Stephanie Kelly,Kendra Mccoy,2024-10-11 15:49,2024-10-11 12:00,completed,Service completed successfully.,5,Great work quality and attention to detail. Maintain catch democratic card beat.
48,Plumbing Service,Stephanie Kelly,Kendra Mccoy,2024-09-22 15:49,2024-09-22 12:00,completed,Service completed successfully.,4,Professional and efficient work. Nature mean animal matter only.
49,House Painting,Heather Lawson,Suzanne Ware,2024-10-07 15:49,2024-10-07 17:00,completed,Service completed successfully.,5,Great work quality and attention to detail. Black keep population old run firm.
50,Plumbing Service,Heather Lawson,Suzanne Ware,2024-10-23 15:49,2024-10-23 14:00,completed,Service completed successfully.,2,"Below expectations, multiple issues. Traditional not Mrs drop cause southern medical."
51,Electrical Work,Heather Lawson,Mrs. Mia Williams,2024-09-02 15:49,2024-09-02 14:00,completed,Service completed successfully.,5,"Outstanding service, highly recommended! East cultural offer alone."
