Request ID,Service,Customer Name,Professional Name,Date Requested,Date Completed,Status,Remarks,Rating,Review Comment
1,Home Cleaning,Scott Hickman,Lauren Hudson,2024-10-01 15:14,2024-10-01 17:00,completed,Service completed successfully.,4,Quality service but a bit expensive. Exactly step score organization idea.
2,House Painting,Scott Hickman,Michael Richardson,2024-11-08 15:14,2024-11-08 17:00,completed,Service completed successfully.,5,Great work quality and attention to detail. Detail shoulder attorney remain show decision father.
3,House Painting,Brandon Rivera,Michael Richardson,2024-11-09 15:14,2024-11-09 17:00,completed,Service completed successfully.,4,"Good service, met expectations. Technology sort nor agree lawyer two give against."
4,Home Cleaning,Brandon Rivera,Angela Mendoza DDS,2024-11-09 15:14,2024-11-09 13:00,completed,Service completed successfully.,2,"Below expectations, multiple issues. Else side leave."
5,Plumbing Service,Katherine Jenkins,Derrick Perez,2024-09-23 15:14,2024-09-23 11:00,completed,Service completed successfully.,2,"Below expectations, multiple issues. Near public system attorney."
6,Home Cleaning,Katherine Jenkins,Michael Richardson,2024-11-11 15:14,2024-11-11 16:00,completed,Service completed successfully.,4,"Good service, met expectations. Film scientist feeling."
7,Home Cleaning,Katherine Jenkins,Angela Mendoza DDS,2024-11-20 15:14,2024-11-20 17:00,completed,Service completed successfully.,5,Excellent service! Very professional and punctual. To explain poor them.
8,Plumbing Service,Donna Crawford,Lauren Hudson,2024-09-29 15:14,2024-09-29 10:00,completed,Service completed successfully.,4,Professional and efficient work. Difference particular course car charge forget might.
9,Home Cleaning,Donna Crawford,Anthony Gutierrez,2024-10-12 15:14,2024-10-12 17:00,completed,Service completed successfully.,3,"Average service, room for improvement. Late home work agree stand data view system."
10,Electrical Work,Donna Crawford,Steven Cochran,2024-09-01 15:14,2024-09-01 16:00,completed,Service completed successfully.,5,Excellent service! Very professional and punctual. Back garden worker.
11,Home Cleaning,Donna Crawford,Lauren Hudson,2024-11-09 15:14,2024-11-09 14:00,completed,Service completed successfully.,4,"Good service, met expectations. Accept performance water able various."
12,Home Cleaning,Melissa Johnson,Derrick Perez,2024-11-20 15:14,2024-11-20 13:00,completed,Service completed successfully.,1,Very disappointing service. Want remember against civil.
13,Home Cleaning,Melissa Johnson,Ashley Cunningham,2024-09-06 15:14,2024-09-06 17:00,completed,Service completed successfully.,2,"Below expectations, multiple issues. Building movement reality."
14,House Painting,Melissa Johnson,Derrick Perez,2024-09-23 15:14,2024-09-23 17:00,completed,Service completed successfully.,N/A,N/A
15,Home Cleaning,Melissa Johnson,Michael Richardson,2024-09-19 15:14,2024-09-19 13:00,completed,Service completed successfully.,3,"Average service, room for improvement. World thought civil work firm person shake."
16,Home Cleaning,Robert Hicks,Derrick Perez,2024-09-26 15:14,2024-09-26 13:00,completed,Service completed successfully.,5,Great work quality and attention to detail. Responsibility where western son deep production.
17,House Painting,Robert Hicks,Michael Richardson,2024-11-16 15:14,2024-11-16 17:00,completed,Service completed successfully.,3,"Average service, room for improvement. Agent operation seek husband truth."
18,Plumbing Service,Robert Hicks,Steven Cochran,2024-11-04 15:14,2024-11-04 16:00,completed,Service completed successfully.,5,"Outstanding service, highly recommended! Sea begin black tonight read success ahead various."
19,Plumbing Service,Robert Hicks,Angela Mendoza DDS,2024-10-09 15:14,2024-10-09 17:00,completed,Service completed successfully.,N/A,N/A
20,Home Cleaning,Robert Hicks,Angela Mendoza DDS,2024-09-12 15:14,2024-09-12 16:00,completed,Service completed successfully.,5,Excellent service! Very professional and punctual. Out she current which.
21,House Painting,Amy Padilla,Lauren Hudson,2024-09-13 15:14,2024-09-13 17:00,completed,Service completed successfully.,4,Professional and efficient work. Teach wish learn item computer.
22,Home Cleaning,Amy Padilla,Steven Cochran,2024-11-06 15:14,2024-11-06 16:00,completed,Service completed successfully.,4,Quality service but a bit expensive. Anything total often great difference.
23,House Painting,Amy Padilla,Steven Cochran,2024-10-14 15:14,2024-10-14 17:00,completed,Service completed successfully.,2,"Below expectations, multiple issues. Technology tree at set its assume fight."
24,Home Cleaning,Amy Padilla,Steven Cochran,2024-09-08 15:14,2024-09-08 13:00,completed,Service completed successfully.,2,"Below expectations, multiple issues. Mission raise west message."
25,Home Cleaning,Erica Castillo,Lauren Hudson,2024-11-04 15:14,2024-11-04 16:00,completed,Service completed successfully.,2,"Below expectations, multiple issues. Human source writer notice."
26,Home Cleaning,Erica Castillo,Michael Richardson,2024-09-04 15:14,2024-09-04 14:00,completed,Service completed successfully.,4,Professional and efficient work. But health continue us.
27,Plumbing Service,Erica Castillo,Steven Cochran,2024-11-21 15:14,2024-11-21 11:00,completed,Service completed successfully.,3,Work done but communication was poor. Within American most society prepare television push.
28,Plumbing Service,Ashley Santiago,Lauren Hudson,2024-09-10 15:14,2024-09-10 14:00,completed,Service completed successfully.,4,"Good service, met expectations. Upon social series amount arm edge executive something."
29,Home Cleaning,Ashley Santiago,Ashley Cunningham,2024-11-23 15:14,2024-11-23 15:00,completed,Service completed successfully.,5,Excellent service! Very professional and punctual. Southern bank establish group buy.
30,Plumbing Service,Ashley Santiago,Steven Cochran,2024-10-15 15:14,2024-10-15 11:00,completed,Service completed successfully.,5,Great work quality and attention to detail. Suggest ability during report place seem song somebody.
31,Home Cleaning,Caroline Garcia,Angela Mendoza DDS,2024-11-18 15:14,2024-11-18 15:00,completed,Service completed successfully.,1,Very disappointing service. Black decision course situation couple short close material.
32,Home Cleaning,Caroline Garcia,Ashley Cunningham,2024-11-02 15:14,2024-11-02 14:00,completed,Service completed successfully.,1,Very disappointing service. Bit her close organization able everybody.
33,Plumbing Service,Caroline Garcia,Michael Richardson,2024-09-10 15:14,2024-09-10 13:00,completed,Service completed successfully.,3,Work done but communication was poor. Assume speech reflect break.
34,Plumbing Service,Caroline Garcia,Steven Cochran,2024-10-16 15:14,2024-10-16 17:00,completed,Service completed successfully.,4,Professional and efficient work. Identify home mission special weight suggest remember.
35,House Painting,Caroline Garcia,Angela Mendoza DDS,2024-10-25 15:14,2024-10-25 17:00,completed,Service completed successfully.,2,"Below expectations, multiple issues. When tough worry not free style couple."
36,House Painting,Thomas Medina,Anthony Gutierrez,2024-10-15 15:14,2024-10-15 17:00,completed,Service completed successfully.,4,"Good service, met expectations. Trade south hand government."
37,Electrical Work,Thomas Medina,Michael Richardson,2024-11-16 15:14,2024-11-16 16:00,completed,Service completed successfully.,4,"Good service, met expectations. All author happy employee suffer others hit action."
38,Home Cleaning,Thomas Medina,Derrick Perez,2024-11-24 15:14,2024-11-24 13:00,completed,Service completed successfully.,4,Quality service but a bit expensive. Low stand son time.
39,Plumbing Service,Thomas Medina,Ashley Cunningham,2024-10-25 15:14,2024-10-25 11:00,completed,Service completed successfully.,5,Excellent service! Very professional and punctual. Language over expect represent particularly rest rather.
40,Home Cleaning,Thomas Medina,Angela Mendoza DDS,2024-11-16 15:14,2024-11-16 15:00,completed,Service completed successfully.,4,Professional and efficient work. Success perform director leave upon including child.
41,Plumbing Service,Courtney Collier,Ashley Cunningham,2024-10-23 15:14,2024-10-23 15:00,completed,Service completed successfully.,1,Very disappointing service. Serve total six eight.
42,House Painting,Courtney Collier,Ashley Cunningham,2024-09-05 15:14,2024-09-05 17:00,completed,Service completed successfully.,N/A,N/A
43,Plumbing Service,Courtney Collier,Ashley Cunningham,2024-10-03 15:14,2024-10-03 17:00,completed,Service completed successfully.,4,Professional and efficient work. Group I professional often Republican.
44,Home Cleaning,Courtney Collier,Angela Mendoza DDS,2024-10-28 15:14,2024-10-28 14:00,completed,Service completed successfully.,N/A,N/A
45,Home Cleaning,Jeffrey Wade,Steven Cochran,2024-11-13 15:14,2024-11-13 16:00,completed,Service completed successfully.,4,Professional and efficient work. Notice possible develop information message Mrs.
46,Plumbing Service,Jeffrey Wade,Angela Mendoza DDS,2024-10-16 15:14,2024-10-16 10:00,completed,Service completed successfully.,5,"Outstanding service, highly recommended! Skill performance dinner line music myself."
47,House Painting,Jeffrey Wade,Steven Cochran,2024-11-11 15:14,2024-11-11 17:00,completed,Service completed successfully.,5,"Outstanding service, highly recommended! Partner garden safe cost."
48,Home Cleaning,Jeffrey Wade,Michael Richardson,2024-09-30 15:14,2024-09-30 17:00,completed,Service completed successfully.,1,Very disappointing service. Financial add friend truth have.
49,Plumbing Service,Jeffrey Wade,Lauren Hudson,2024-10-20 15:14,2024-10-20 15:00,completed,Service completed successfully.,4,Quality service but a bit expensive. Beyond common name.
50,Home Cleaning,Jason Walker,Steven Cochran,2024-09-18 15:14,2024-09-18 16:00,completed,Service completed successfully.,5,Excellent service! Very professional and punctual. Trip day near audience.
51,Home Cleaning,Jason Walker,Ashley Cunningham,2024-11-15 15:14,2024-11-15 17:00,completed,Service completed successfully.,2,"Below expectations, multiple issues. Position word when drug language per."
52,Electrical Work,Jason Boyd,Derrick Perez,2024-10-01 15:14,2024-10-01 12:00,completed,Service completed successfully.,4,Quality service but a bit expensive. Position enter bit activity true lawyer personal send.
53,Home Cleaning,Jason Boyd,Lauren Hudson,2024-09-15 15:14,2024-09-15 17:00,completed,Service completed successfully.,5,Excellent service! Very professional and punctual. Similar me work partner town live appear situation.
