Request ID,Service,Customer Name,Professional Name,Date Requested,Date Completed,Status,Remarks,Rating,Review Comment
1,Plumbing Service,Denise Castillo,Scott Snow,2024-11-05 14:45,2024-11-05 17:00,completed,Service completed successfully.,5,"Outstanding service, highly recommended! Several across staff maybe."
2,Plumbing Service,Denise Castillo,Scott Snow,2024-09-11 14:45,2024-09-11 11:00,completed,Service completed successfully.,3,Work done but communication was poor. This common street up policy control accept low.
3,Electrical Work,Denise Castillo,Adam Campos,2024-10-10 14:45,2024-10-10 14:00,completed,Service completed successfully.,4,"Good service, met expectations. Everyone you book thousand rich third about."
4,Electrical Work,Courtney Richardson,Adam Campos,2024-11-02 14:45,2024-11-02 13:00,completed,Service completed successfully.,5,"Outstanding service, highly recommended! Room place add gas spring."
5,Plumbing Service,Courtney Richardson,Scott Snow,2024-09-05 14:45,2024-09-05 13:00,completed,Service completed successfully.,5,"Outstanding service, highly recommended! Class not approach end green race."
6,Plumbing Service,Courtney Richardson,Adam Campos,2024-11-23 14:45,2024-11-23 15:00,completed,Service completed successfully.,5,"Outstanding service, highly recommended! Important member into off often."
7,House Painting,Courtney Richardson,Adam Campos,2024-09-28 14:45,2024-09-28 17:00,completed,Service completed successfully.,3,"Average service, room for improvement. Positive president until."
8,Plumbing Service,Courtney Richardson,Adam Campos,2024-10-21 14:45,2024-10-21 14:00,completed,Service completed successfully.,2,"Below expectations, multiple issues. Each live nothing drop hit."
9,Electrical Work,Veronica Ingram,Scott Snow,2024-11-21 14:45,2024-11-21 15:00,completed,Service completed successfully.,4,Professional and efficient work. Go final bit enjoy.
10,House Painting,Veronica Ingram,Adam Campos,2024-10-15 14:45,2024-10-15 17:00,completed,Service completed successfully.,4,"Good service, met expectations. Into project like probably."
11,Plumbing Service,Veronica Ingram,Scott Snow,2024-11-09 14:45,2024-11-09 12:00,completed,Service completed successfully.,1,Very disappointing service. Chair camera show few account respond.
12,Home Cleaning,Mariah Herrera,Scott Snow,2024-09-28 14:45,2024-09-28 13:00,completed,Service completed successfully.,5,"Outstanding service, highly recommended! Budget watch wish stand for fact."
13,Electrical Work,Mariah Herrera,Adam Campos,2024-11-03 14:45,2024-11-03 12:00,completed,Service completed successfully.,1,Very disappointing service. Bad recognize attack financial thousand purpose mean movement.
14,Plumbing Service,Mariah Herrera,Scott Snow,2024-10-26 14:45,2024-10-26 14:00,completed,Service completed successfully.,2,"Below expectations, multiple issues. Allow interesting fear according see."
15,Home Cleaning,Maria Anderson,Adam Campos,2024-10-19 14:45,2024-10-19 15:00,completed,Service completed successfully.,5,Great work quality and attention to detail. Popular save budget should serve without never.
16,Home Cleaning,Maria Anderson,Scott Snow,2024-10-20 14:45,2024-10-20 15:00,completed,Service completed successfully.,4,"Good service, met expectations. See watch detail college."
17,Plumbing Service,Maria Anderson,Scott Snow,2024-09-26 14:45,2024-09-26 10:00,completed,Service completed successfully.,2,"Below expectations, multiple issues. Record important draw compare manage."
18,House Painting,Tony Lyons,Scott Snow,2024-10-17 14:45,2024-10-17 17:00,completed,Service completed successfully.,4,Quality service but a bit expensive. Process large position.
19,Plumbing Service,Tony Lyons,Adam Campos,2024-09-12 14:45,2024-09-12 13:00,completed,Service completed successfully.,4,Quality service but a bit expensive. Standard reveal almost consider hundred big one.
20,Plumbing Service,Tony Lyons,Scott Snow,2024-10-08 14:45,2024-10-08 12:00,completed,Service completed successfully.,3,"Average service, room for improvement. Rest laugh south fund eye husband economic."
21,Home Cleaning,James Holmes,Scott Snow,2024-09-28 14:45,2024-09-28 15:00,completed,Service completed successfully.,2,"Below expectations, multiple issues. Bar office state majority meet discover material."
22,House Painting,James Holmes,Adam Campos,2024-09-11 14:45,2024-09-11 17:00,completed,Service completed successfully.,2,"Below expectations, multiple issues. Fish level business financial over computer."
23,Plumbing Service,James Holmes,Adam Campos,2024-10-16 14:45,2024-10-16 11:00,completed,Service completed successfully.,4,Quality service but a bit expensive. East report sea want end.
24,Home Cleaning,Lacey Stephens,Adam Campos,2024-09-11 14:45,2024-09-11 17:00,completed,Service completed successfully.,5,"Outstanding service, highly recommended! Kind cultural professional industry."
25,Electrical Work,Lacey Stephens,Scott Snow,2024-10-23 14:45,2024-10-23 13:00,completed,Service completed successfully.,N/A,N/A
26,Electrical Work,Lacey Stephens,Adam Campos,2024-10-17 14:45,2024-10-17 13:00,completed,Service completed successfully.,1,Very disappointing service. Hold study attorney purpose much.
27,Home Cleaning,Lacey Stephens,Adam Campos,2024-09-21 14:45,2024-09-21 16:00,completed,Service completed successfully.,4,Quality service but a bit expensive. Challenge ability question it brother event identify.
28,Home Cleaning,Lacey Stephens,Scott Snow,2024-09-30 14:45,2024-09-30 14:00,completed,Service completed successfully.,1,Very disappointing service. My year beat song sometimes anyone.
29,House Painting,Mary Jones PhD,Adam Campos,2024-09-24 14:45,2024-09-24 17:00,completed,Service completed successfully.,5,"Outstanding service, highly recommended! High loss sense voice fish into hope."
30,Electrical Work,Mary Jones PhD,Adam Campos,2024-10-30 14:45,2024-10-30 12:00,completed,Service completed successfully.,1,Very disappointing service. You bag item prepare.
31,Home Cleaning,Brian Morgan,Scott Snow,2024-11-04 14:45,2024-11-04 13:00,completed,Service completed successfully.,4,"Good service, met expectations. Wait face hair war generation."
32,Home Cleaning,Brian Morgan,Adam Campos,2024-10-02 14:45,2024-10-02 14:00,completed,Service completed successfully.,3,Work done but communication was poor. Score its campaign project after while.
33,Plumbing Service,Brian Morgan,Adam Campos,2024-10-05 14:45,2024-10-05 12:00,completed,Service completed successfully.,2,"Below expectations, multiple issues. Some generation assume."
34,Plumbing Service,Betty Buck,Adam Campos,2024-10-21 14:45,2024-10-21 10:00,completed,Service completed successfully.,5,"Outstanding service, highly recommended! Appear continue themselves debate under nation."
35,House Painting,Betty Buck,Scott Snow,2024-11-02 14:45,2024-11-02 17:00,completed,Service completed successfully.,4,Quality service but a bit expensive. Material pass show buy.
36,Home Cleaning,Betty Buck,Scott Snow,2024-11-11 14:45,2024-11-11 16:00,completed,Service completed successfully.,N/A,N/A
37,Electrical Work,Michael Maxwell,Scott Snow,2024-10-11 14:45,2024-10-11 14:00,completed,Service completed successfully.,5,"Outstanding service, highly recommended! Girl improve past exist."
38,House Painting,Michael Maxwell,Adam Campos,2024-10-16 14:45,2024-10-16 17:00,completed,Service completed successfully.,4,Quality service but a bit expensive. Morning move power appear major season might.
39,Electrical Work,Michael Maxwell,Adam Campos,2024-09-05 14:45,2024-09-05 15:00,completed,Service completed successfully.,5,Great work quality and attention to detail. Close land account game country.
40,Electrical Work,Michael Maxwell,Adam Campos,2024-10-14 14:45,2024-10-14 14:00,completed,Service completed successfully.,5,"Outstanding service, highly recommended! Window marriage wait now book election."
41,House Painting,Michael Maxwell,Scott Snow,2024-10-12 14:45,2024-10-12 17:00,completed,Service completed successfully.,5,Great work quality and attention to detail. Less five there itself issue hope ball.
42,Plumbing Service,Elizabeth Thomas,Adam Campos,2024-10-02 14:45,2024-10-02 13:00,completed,Service completed successfully.,4,Professional and efficient work. Draw road court line.
43,Electrical Work,Elizabeth Thomas,Adam Campos,2024-10-15 14:45,2024-10-15 17:00,completed,Service completed successfully.,5,"Outstanding service, highly recommended! Reality benefit study."
44,Plumbing Service,Elizabeth Thomas,Adam Campos,2024-10-25 14:45,2024-10-25 17:00,completed,Service completed successfully.,5,Great work quality and attention to detail. Century whether grow bag us end.
45,Home Cleaning,Elizabeth Thomas,Scott Snow,2024-10-17 14:45,2024-10-17 14:00,completed,Service completed successfully.,1,Very disappointing service. Record real radio.
46,Home Cleaning,Edwin Parker,Adam Campos,2024-09-11 14:45,2024-09-11 15:00,completed,Service completed successfully.,3,Work done but communication was poor. Traditional bank hair space bed.
47,House Painting,Edwin Parker,Adam Campos,2024-09-12 14:45,2024-09-12 17:00,completed,Service completed successfully.,5,"Outstanding service, highly recommended! Third suffer our star movement."
48,Electrical Work,Edwin Parker,Adam Campos,2024-11-05 14:45,2024-11-05 16:00,completed,Service completed successfully.,3,"Average service, room for improvement. Its most full return hospital bank personal."
49,Home Cleaning,Edwin Parker,Adam Campos,2024-11-20 14:45,2024-11-20 15:00,completed,Service completed successfully.,3,Work done but communication was poor. Star guess produce station.
50,House Painting,Edwin Parker,Adam Campos,2024-11-14 14:45,2024-11-14 17:00,completed,Service completed successfully.,3,"Average service, room for improvement. Collection everybody per off down turn fill."
51,Electrical Work,Kimberly Williams,Scott Snow,2024-10-16 14:45,2024-10-16 16:00,completed,Service completed successfully.,3,Work done but communication was poor. Eat fear enter.
52,Home Cleaning,Kimberly Williams,Adam Campos,2024-11-03 14:45,2024-11-03 13:00,completed,Service completed successfully.,N/A,N/A
53,Home Cleaning,Kimberly Williams,Scott Snow,2024-11-15 14:45,2024-11-15 14:00,completed,Service completed successfully.,4,"Good service, met expectations. Large movement line alone."
54,Home Cleaning,Kimberly Williams,Scott Snow,2024-11-21 14:45,2024-11-21 16:00,completed,Service completed successfully.,4,Quality service but a bit expensive. Trial information eight shake.
